Title,Link,Desc,author
Topology-Aware Tokenization for Generative Recommendation,https://arxiv.org/abs/2607.18600,"Generative recommendation reformulates sequential recommendation as an autoregressive generation task, yet a critical issue in this paradigm remains overlooked: topology distortion in item tokenization. In particular, we observe that the intrinsic adjacency relationships of items in the pretrained semantic embedding space are significantly disrupted after quantization. This topology distortion misleads the model's perception of item similarity, ultimately bottlenecking the accuracy of generative recommendations. To address this issue, we propose Topology-Aware Tokenization (TopoTok), an item tokenization framework that preserves item relational structure throughout the quantization hierarchy. Different from the prior monolithic supervision in tokenization, TopoTok introduces a multi-level distillation scheme to progressively recover the topology from coarse to fine granularity: 1) Inter-Group Distillation to capture global cluster-wise relations; 2) Intra-Group Distillation to refine local structures within semantic clusters; and 3) Inter-Item Distillation to enforce fine-grained alignment at the individual item level. Extensive experiments on three benchmark datasets demonstrate that TopoTok effectively alleviates topology distortion and consistently outperforms state-of-the-art tokenizers, achieving significant performance gains of up to 9.42% in Recall@5.","Yaokun Liu, Yifan Liu, Zhenrui Yue, Gyuseok Lee, Zelin Li, Ruichen Yao, Dong Wang"
Beyond Noisy Signals: Dual-Level Denoising for Multi-modal Sequential Recommendation,https://arxiv.org/abs/2607.18786,"Multi-modal Sequential Recommendation (SR) incorporates rich side information (e.g., textual and visual features) to enhance dynamic user preference modeling. However, existing frameworks inevitably suffer from a \textbf{Dual-Noise Dilemma}: (1) \textit{Feature-level redundancy} stemming from the semantic gap between generic pre-trained representations and fine-grained recommendation intent; and (2) \textit{Sequence-level stochasticity} induced by spurious interactions such as accidental clicks. To break this bottleneck, we propose \textbf{DDMSR}, a novel \textbf{D}ual-level \textbf{D}enoising \textbf{M}ulti-modal \textbf{S}equential \textbf{R}ecommendation framework that systematically purifies signals from both feature-topological and sequence-frequency perspectives. Specifically, we first design a graph-based feature denoising module that leverages Laplacian smoothing on item semantic graphs as a structural low-pass filter, effectively suppressing high-frequency semantic noise while preserving salient features. For sequence purification, we introduce a frequency-domain sequence denoising module, utilizing the Fast Fourier Transform and a learnable frequency filter to adaptively modulate the interaction spectrum and attenuate anomalous signals. Furthermore, a multi-modal contrastive alignment objective is incorporated to bridge the heterogeneity gap and enforce cross-modal semantic consistency. Extensive experiments on four public benchmark datasets demonstrate that DDMSR consistently outperforms state-of-the-art baselines, providing a highly robust and efficient solution for multi-modal sequential recommendation. The source code is available at: ~\href{https://github.com/jluo00/DDMSR}{\textcolor{blue}{https://github.com/jluo00/DDMSR}}.","Jie Luo, Qi Jin, Xinming Zhang"
TSGR: Taobao Search Generative Retrieval,https://arxiv.org/abs/2607.18796,"Generative retrieval (GR) has demonstrated strong promise for industrial e-commerce search by training a single autoregressive model to directly generate the Semantic IDs (SIDs) of target items. However, existing GR systems are primarily optimized for semantic matching and remain insensitive to item business value: SID construction is value-unaware, and candidates are ranked without access to item side-info. Consequently, high-value items are often missed or deprioritized at the retrieval stage, limiting downstream business impact. This limitation is particularly critical in industrial settings such as Taobao Search, where business objectives are central to system design. To address this, we propose $\textbf{T}$aobao $\textbf{S}$earch $\textbf{G}$enerative $\textbf{R}$etrieval ($\textbf{TSGR}$), a unified generative retrieval framework that incorporates value awareness into both item representation and candidate ranking. 1) For item representation, TSGR introduces $\textbf{Query-aware Parallel SID (QP-SID)}$, which encodes query-conditioned value orderings into the SID construction by building parallel codebooks derived from query-item statistics, so that higher-value and query-relevant items are assigned better token indices. 2) For candidate ranking, we introduce a $\textbf{Value-aware Ranking Module (VRM)}$ that is built upon and jointly optimized with the GR, enabling a single model to seamlessly serve as both retriever and pre-ranker without a dedicated pre-ranking stage. A progressive training pipeline further aligns the model with semantic relevance, user preferences, and business objectives. Offline experiments show that TSGR achieves an 9.16% improvement in HR@1000, and online A/B tests further validate its effectiveness, yielding gains of +0.43% in IPV, +1.12% in Transaction Count, and +1.64% in GMV.","Tianyu Zhan, Gui Ling, Tong Xiong, Kunhai Lin, Yang Wang, Kaixuan Zhang, Zhihong Chen, Yuliang Yan, Dan Ou, Shengyu Zhang, Haihong Tang, Bo Zheng"
Vectorizing the Trie: Efficient Constrained Decoding for LLM-based Generative Retrieval on Accelerators,https://arxiv.org/abs/2602.22647,"Generative retrieval has emerged as a powerful paradigm for LLM-based recommendation. However, industrial recommender systems often benefit from restricting the output space to a constrained subset of items based on business logic (e.g. enforcing content freshness or product category), which standard autoregressive decoding cannot natively support. Moreover, existing constrained decoding methods that make use of prefix trees (Tries) incur severe latency penalties on hardware accelerators (TPUs/GPUs). In this work, we introduce STATIC (Sparse Transition Matrix-Accelerated Trie Index for Constrained Decoding), an efficient and scalable constrained decoding technique designed specifically for high-throughput LLM-based generative retrieval on TPUs/GPUs. By flattening the prefix tree into a static Compressed Sparse Row (CSR) matrix, we transform irregular tree traversals into fully vectorized sparse matrix operations, unlocking massive efficiency gains on hardware accelerators. We deploy STATIC on a large-scale industrial video recommendation platform serving billions of users. STATIC produces significant product metric impact with minimal latency overhead (0.033 ms per step and 0.25% of inference time), achieving a 948x speedup over a CPU trie implementation and a 47-1033x speedup over a hardware-accelerated binary-search baseline. Furthermore, the runtime overhead of STATIC remains extremely low across a wide range of practical configurations. To the best of our knowledge, STATIC enables the first production-scale deployment of strictly constrained generative retrieval. In addition, evaluation on academic benchmarks demonstrates that STATIC can considerably improve cold-start performance for generative retrieval. Our code is available at https://github.com/youtube/static-constraint-decoding.","Zhengyang Su, Isay Katsman, Yueqi Wang, Ruining He, Lukasz Heldt, Raghunandan Keshavan, Shao-Chuan Wang, Xinyang Yi, Mingyan Gao, Onkar Dalal, Lichan Hong, Ed Chi, Ningren Han"
An LLM-powered Agentic Recommendation System for Connected TV Content Discovery,https://arxiv.org/abs/2607.09988,"Recommendation systems, from traditional multi-stage to recent unified generative architectures, face challenges in incorporating diverse contextual signals, such as trending topics, breaking news, cultural events, and cross-surface user activities, into their ranking pipelines. These systems are designed to consume structured behavioral signals with consistent schemas, and lack the reasoning capability to naturally process unstructured or heterogeneously formatted contextual information. Incorporating such signals typically requires feature engineering, bespoke data pipelines, and carefully tuned heuristics. In this paper, we present an LLM-powered agentic recommendation system designed for Connected TV (CTV) content discovery that addresses these limitations. Our system leverages the reasoning capabilities of large language models to naturally process and synthesize diverse signals across varying schemas and structures, eliminating much of the manual integration inherent in traditional ranking and retrieval systems. Recognizing that current LLM-based solutions still fall short of traditional machine learning models in several recommendation tasks, including retrieval efficiency, personalization precision, and scalability, we adopt an agentic architecture that orchestrates specialized components, allowing each sub-task to be handled by the most suitable method, whether LLM-based or traditional ML. The main contribution of this work is our engineering approach to successfully overcoming the practical limitations of enabling LLM for recommendation, particularly inference latency. We share insights from our work and discuss the trade-offs and lessons learned in building a hybrid system that combines the flexibility of LLMs with the performance of established recommendation techniques.","Lei Shi, Di Wang, Harry Tran, Helsing Xu, Yuchen Lu, Dhara Ghodasara, Wilson Chaney, Xueting Liao, Jerry Yu, Huayu Ding, Reza Mirghaderi, David Fan, Qi Guo, Chongguang He, Warren Wang, Mingze Gao, Shike Mei, Shuo Tang, Zhe Zhang, Jianming He, Abhishek Kumar, Haotian Wu, Hamed Firooz, Li Li"
