Title,Link,Desc,author
Exploring LLM biases to manipulate AI search overview,https://arxiv.org/abs/2605.00012,"Modern large language models (LLMs) are used in many business applications in general, and specifically in web search systems and applications that generate overviews of search results - LLM Overview systems. Such systems are using an LLM to select most relevant sources from search results and generate an answer to the user's query. It is known from many studies that LLMs have different biases, in LLM Overview application both the source selection and answer generation stages may be affected by the biases of LLMs (here we are focusing mainly on the selection stage). This research is focused on investigating the presence of the biases in LLM Overview systems and on biases exploitation to manipulate LLM Overview results. Here we train a small language model using reinforcement learning to rewrite search snippets to increase their likelihood of being preferred by an LLM Overview. Our experimental setup intentionally restricts the policy to operate only on snippets and limits reward-hacking strategies, reflecting realistic constraints of web search environments. The results prove that LLM Overview systems have biases and that reinforcement learning in most of the cases can optimize snippet's content to manipulate LLM Overview results. We also prove that LLM Overview selections are driven by comparative rather than absolute advantages among candidate sources. In addition, we examine safety aspects of LLM Overview manipulation possibilities and show that context poisoning attacks can lead to inaccurate or harmful results.",Roman Smirnov
LLM-Oriented Information Retrieval: A Denoising-First Perspective,https://arxiv.org/abs/2605.00505,"Modern information retrieval (IR) is no longer consumed primarily by humans but increasingly by large language models (LLMs) via retrieval-augmented generation (RAG) and agentic search. Unlike human users, LLMs are constrained by limited attention budgets and are uniquely vulnerable to noise; misleading or irrelevant information is no longer just a nuisance, but a direct cause of hallucinations and reasoning failures. In this perspective paper, we argue that denoising-maximizing usable evidence density and verifiability within a context window-is becoming the primary bottleneck across the full information access pipeline. We conceptualize this paradigm shift through a four-stage framework of IR challenges: from inaccessible to undiscoverable, to misaligned, and finally to unverifiable. Furthermore, we provide a pipeline-organized taxonomy of signal-to-noise optimization techniques, spanning indexing, retrieval, context engineering, verification, and agentic workflow. We also present research works on information denoising in domains that rely heavily on retrieval such as lifelong assistant, coding agent, deep research, and multimodal understanding.","Lu Dai, Liang Sun, Fanpu Cao, Ziyang Rao, Cehao Yang, Hao Liu, Hui Xiong"
Robust Multimodal Recommendation via Graph Retrieval-Enhanced Modality Completion,https://arxiv.org/abs/2605.00670,"Multimodal data plays a critical role in web-based recommendation systems, where information from diverse modalities such as vision and text enhances representation learning. However, real-world multimodal datasets often suffer from modality incompleteness due to sensor failures, annotation scarcity, or privacy constraints, which substantially degrade model performance and reliability. One effective solution to address this issue is modality completion, which reconstructs missing features to provide modality-complete graphs for downstream tasks. Given a query node with missing multimodal features, existing modality completion methods typically infer information from the node itself or its neighbors to reconstruct the missing modality. However, these methods may overlook semantically relevant context in the graph, which contains valuable cues that are non-trivial to capture through simple methods like neighborhood aggregation. In this work, we propose GRE-MC, a Graph Retrieval-Enhanced Modality Completion framework, to overcome these limitations. By introducing a modality-aware subgraph retrieval mechanism, GRE-MC selects semantically relevant subgraphs from the entire graph, providing richer contextual information for completing missing modalities. Subsequently, a graph transformer jointly encodes the query node and the retrieved subgraph via global attention to complete the missing features, while a learnable sparse-routing codebook regularizes latent embeddings into compact bases for improved robustness. Extensive experiments on multimodal recommendation benchmarks demonstrate that GRE-MC consistently outperforms state-of-the-art methods, validating the effectiveness of subgraph retrieval and joint-encoding graph transformer for robust modality completion.","Yuan Li, Jun Hu, Jiaxin Jiang, Bryan Hooi, Bingsheng He"
DeGenTWeb: A First Look at LLM-dominant Websites,https://arxiv.org/abs/2605.00087,"Many recent news reports have claimed that content generated by large language models (LLMs) is taking over the web. However, these claims are typically not based on a representative sample of the web and the methodology underlying them is often opaque. Moreover, when aiming to minimize the chances of falsely attributing human-authored content to LLMs, we find that detectors of LLM-generated text perform much worse than advertised. Consequently, we lack an understanding of the true prevalence and characteristics of LLM content on the web.
  We describe DeGenTWeb which systematically identifies LLM-dominant websites: sites whose content has been generated using LLMs with little human input. We show how to adapt detectors of LLM-generated text for use on web pages, and how to aggregate detection results from multiple pages on a site for accurate site-level categorization. Using DeGenTWeb, we find that LLM-dominant sites are highly prevalent both in data from Common Crawl and in Bing's search results, and that this share is growing over time. We also show that continuing to accurately identify such sites appears challenging given the capabilities of the latest LLMs.","Sichang Steven He, Calvin Ardi, Ramesh Govindan, Harsha V. Madhyastha"
GenRecEdit: Adapting Model Editing for Generative Recommendation with Cold-Start Items,https://arxiv.org/abs/2603.14259,"Generative recommendation (GR) has shown strong potential for sequential recommendation in an end-to-end generation paradigm. However, existing GR models suffer from severe cold-start collapse: their recommendation accuracy on cold-start items can drop to near zero. Current solutions typically rely on retraining with cold-start interactions, which is hindered by sparse feedback, high computational cost, and delayed updates, limiting practical utility in rapidly evolving recommendation catalogs. Inspired by model editing in NLP, which enables training-free knowledge injection into large language models, we explore how to bring this paradigm to generative recommendation. This, however, faces two key challenges: GR lacks the explicit subject-object binding common in natural language, making targeted edits difficult; and GR does not exhibit stable token co-occurrence patterns, making the injection of multi-token item representations unreliable. To address these challenges, we propose GenRecEdit, a model editing framework tailored for generative recommendation. GenRecEdit explicitly models the relationship between the full sequence context and next-token generation, adopts iterative token-level editing to inject multi-token item representations, and introduces a one-to-one trigger mechanism to reduce interference among multiple edits during inference. Extensive experiments on multiple datasets show that GenRecEdit substantially improves recommendation performance on cold-start items while preserving the model's original recommendation quality. Moreover, it achieves these gains using only about 9.5% of the training time required for retraining, enabling more efficient and frequent model updates.","Chenglei Shen, Teng Shi, Weijie Yu, Xiao Zhang, Jun Xu"
MemoryBench: A Benchmark for Memory and Continual Learning in LLM Systems,https://arxiv.org/abs/2510.17281,"Scaling up data, parameters, and test-time computation has been the mainstream methods to improve LLM systems (LLMsys), but their upper bounds are almost reached due to the gradual depletion of high-quality data and marginal gains obtained from larger computational resource consumption. Inspired by the abilities of human and traditional AI systems in learning from practice, constructing memory and continual learning frameworks for LLMsys has become an important and popular research direction in recent literature. Yet, existing benchmarks for LLM memory often focus on evaluating the system on homogeneous reading comprehension tasks with long-form inputs rather than testing their abilities to learn from accumulated user feedback in service time. Therefore, we propose a user feedback simulation framework and a comprehensive benchmark covering multiple domains, languages, and types of tasks to evaluate the continual learning abilities of LLMsys. Experiments show that the effectiveness and efficiency of state-of-the-art baselines are far from satisfying, and we hope this benchmark could pave the way for future studies on LLM memory and optimization algorithms.","Qingyao Ai, Yichen Tang, Changyue Wang, Jianming Long, Weihang Su, Yiqun Liu"
Adapting MLLMs for Nuanced Video Retrieval,https://arxiv.org/abs/2512.13511,"Our objective is to build an embedding model that captures the nuanced relationship between a search query and candidate videos. We cover three aspects of nuanced retrieval: (i) temporal, (ii) negation, and (iii) multimodal. For temporal nuance, we consider chiral actions that need distinguishing between temporally opposite actions like ""opening a door"" vs. ""closing a door"". For negation, we consider queries with negators such as ""not"", ""none"" that allow user to specify what they do not want. For multimodal nuance, we consider the task of composed retrieval where the query comprises a video along with a text edit instruction. The goal is to develop a unified embedding model that handles such nuances effectively. To that end, we repurpose a Multimodal Large Language Model (MLLM) trained to generate text into an embedding model. We fine-tune it with a contrastive loss on text alone with carefully sampled hard negatives that instill the desired nuances in the learned embedding space. Despite the text-only training, our method achieves state of the art performance on all benchmarks for nuanced video retrieval. We also analyze how this improvement is achieved, and show that text-only training reduces the modality gap between text and video embeddings leading to better organization of the embedding space.","Piyush Bagad, Andrew Zisserman"
