Title,Link,Desc,author
DReX: An Explainable Deep Learning-based Multimodal Recommendation Framework,https://arxiv.org/abs/2602.19702,"Multimodal recommender systems leverage diverse data sources, such as user interactions, content features, and contextual information, to address challenges like cold-start and data sparsity. However, existing methods often suffer from one or more key limitations: processing different modalities in isolation, requiring complete multimodal data for each interaction during training, or independent learning of user and item representations. These factors contribute to increased complexity and potential misalignment between user and item embeddings. To address these challenges, we propose DReX, a unified multimodal recommendation framework that incrementally refines user and item representations by leveraging interaction-level features from multimodal feedback. Our model employs gated recurrent units to selectively integrate these fine-grained features into global representations. This incremental update mechanism provides three key advantages: (1) simultaneous modeling of both nuanced interaction details and broader preference patterns, (2) eliminates the need for separate user and item feature extraction processes, leading to enhanced alignment in their learned representation, and (3) inherent robustness to varying or missing modalities. We evaluate the performance of the proposed approach on three real-world datasets containing reviews and ratings as interaction modalities. By considering review text as a modality, our approach automatically generates interpretable keyword profiles for both users and items, which supplement the recommendation process with interpretable preference indicators. Experiment results demonstrate that our approach outperforms state-of-the-art methods across all evaluated datasets.","Adamya Shyam, Venkateswara Rao Kagita, Bharti Rana, Vikas Kumar"
Diagnosing LLM Reranker Behavior Under Fixed Evidence Pools,https://arxiv.org/abs/2602.18613,"Standard reranking evaluations study how a reranker orders candidates returned by an upstream retriever. This setup couples ranking behavior with retrieval quality, so differences in output cannot be attributed to the ranking policy alone. We introduce a controlled diagnostic that isolates reranking by using Multi-News clusters as fixed evidence pools. We limit each pool to exactly eight documents and pass identical inputs to all rankers. Within this setup, BM25 and MMR serve as interpretable reference points for lexical matching and diversity optimization. Across 345 clusters, we find that redundancy patterns vary by model: one LLM implicitly diversifies at larger selection budgets, while another increases redundancy. In contrast, LLMs underperform on lexical coverage at small selection budgets. As a result, LLM rankings diverge substantially from both baselines rather than consistently approximating either strategy. By eliminating retrieval variance, we can attribute these differences directly to the ranking policy. This diagnostic is model-agnostic and applicable to any ranker, including open source systems and proprietary APIs.","Baris Arat, Emre Sefer"
"NeuroWise: A Multi-Agent LLM ""Glass-Box"" System for Practicing Double-Empathy Communication with Autistic Partners",https://arxiv.org/abs/2602.18962,"The double empathy problem frames communication difficulties between neurodivergent and neurotypical individuals as arising from mutual misunderstanding, yet most interventions focus on autistic individuals. We present NeuroWise, a multi-agent LLM-based coaching system that supports neurotypical users through stress visualization, interpretation of internal experiences, and contextual guidance. In a between-subjects study (N=30), NeuroWise was rated as helpful by all participants and showed a significant condition-time effect on deficit-based attributions (p=0.02): NeuroWise users reduced deficit framing, while baseline users shifted toward blaming autistic ""deficits"" after difficult interactions. NeuroWise users also completed conversations more efficiently (37% fewer turns, p=0.03). These findings suggest that AI-based interpretation can support attributional change by helping users recognize communication challenges as mutual.","Albert Tang, Yifan Mo, Jie Li, Yue Su, Mengyuan Zhang, Sander L. Koole, Koen Hindriks, Jiahuan Pei"
Unlocking Multimodal Document Intelligence: From Current Triumphs to Future Frontiers of Visual Document Retrieval,https://arxiv.org/abs/2602.19961,"With the rapid proliferation of multimodal information, Visual Document Retrieval (VDR) has emerged as a critical frontier in bridging the gap between unstructured visually rich data and precise information acquisition. Unlike traditional natural image retrieval, visual documents exhibit unique characteristics defined by dense textual content, intricate layouts, and fine-grained semantic dependencies. This paper presents the first comprehensive survey of the VDR landscape, specifically through the lens of the Multimodal Large Language Model (MLLM) era. We begin by examining the benchmark landscape, and subsequently dive into the methodological evolution, categorizing approaches into three primary aspects: multimodal embedding models, multimodal reranker models, and the integration of Retrieval-Augmented Generation (RAG) and Agentic systems for complex document intelligence. Finally, we identify persistent challenges and outline promising future directions, aiming to provide a clear roadmap for future multimodal document intelligence.","Yibo Yan, Jiahao Huo, Guanbo Feng, Mingdong Ou, Yi Cao, Xin Zou, Shuliang Liu, Yuanhuiyi Lyu, Yu Huang, Jungang Li, Kening Zheng, Xu Zheng, Philip S. Yu, James Kwok, Xuming Hu"
Counterfactual Understanding via Retrieval-aware Multimodal Modeling for Time-to-Event Survival Prediction,https://arxiv.org/abs/2602.19987,"This paper tackles the problem of time-to-event counterfactual survival prediction, aiming to optimize individualized survival outcomes in the presence of heterogeneity and censored data. We propose CURE, a framework that advances counterfactual survival modeling via comprehensive multimodal embedding and latent subgroup retrieval. CURE integrates clinical, paraclinical, demographic, and multi-omics information, which are aligned and fused through cross-attention mechanisms. Complex multi-omics signals can be adaptively refined using a mixture-of-experts architecture, emphasizing the most informative omics components. Building upon this representation, CURE implicitly retrieves patient-specific latent subgroups that capture both baseline survival dynamics and treatment-dependent variations. Experimental results on METABRIC and TCGA-LUAD datasets demonstrate that proposed CURE model consistently outperforms strong baselines in survival analysis, evaluated using the Time-dependent Concordance Index ($C^{td}$) and Integrated Brier Score (IBS). These findings highlight the potential of CURE to enhance multimodal understanding and serve as a foundation for future treatment recommendation models. All code and related resources are publicly available to facilitate the reproducibility https://github.com/L2R-UET/CURE.","Ha-Anh Hoang Nguyen, Tri-Duc Phan Le, Duc-Hoang Pham, Huy-Son Nguyen, Cam-Van Thi Nguyen, Duc-Trong Le, Hoang-Quynh Le"
Large-scale Benchmarks for Multimodal Recommendation with Ducho,https://arxiv.org/abs/2409.15857,"The common multimodal recommendation pipeline involves (i) extracting multimodal features, (ii) refining their high-level representations to suit the recommendation task, (iii) optionally fusing all multimodal features, and (iv) predicting the user-item score. Although great effort has been put into designing optimal solutions for (ii-iv), to the best of our knowledge, very little attention has been devoted to exploring procedures for (i) in a rigorous way. In this respect, the existing literature outlines the large availability of multimodal datasets and the ever-growing number of large models accounting for multimodal-aware tasks, but (at the same time) an unjustified adoption of limited standardized solutions. As very recent works from the literature have begun to conduct empirical studies to assess the contribution of multimodality in recommendation, we decide to follow and complement this same research direction. To this end, this paper settles as the first attempt to offer a large-scale benchmarking for multimodal recommender systems, with a specific focus on multimodal extractors. Specifically, we take advantage of three popular and recent frameworks for multimodal feature extraction and reproducibility in recommendation, Ducho, and MMRec/Elliot, respectively, to offer a unified and ready-to-use experimental environment able to run extensive benchmarking analyses leveraging novel multimodal feature extractors. Results, largely validated under different extractors, hyper-parameters of the extractors, domains, and modalities, provide important insights on how to train and tune the next generation of multimodal recommendation algorithms.","Matteo Attimonelli, Danilo Danese, Angela Di Fazio, Daniele Malitesta, Claudio Pomo, Tommaso Di Noia"
PinRec: Unified Generative Retrieval for Pinterest Recommender Systems,https://arxiv.org/abs/2504.10507,"Generative retrieval methods employ sequential modeling techniques, like transformers, to generate candidate items for recommender systems. These methods have demonstrated promising results in academic benchmarks, surpassing traditional retrieval models such as two tower architectures. However, a key limitation is that current approaches require a separate model for each product surface, as building a unified model that accommodates the different business needs of various surfaces has proven challenging. Furthermore, existing methods often fail to capture the evolution of user interests over a sequence, focusing instead on only predicting the next item. This paper introduces PinRec, a novel unified generative retrieval model for all of Pinterest recommendation surfaces, including home feed, search, and related pins. PinRec is pretrained on user activity sequences aggregated across surfaces, then finetuned for each surface using impression data from that surface. This pretraining and finetuning approach enables a single unified model while still adapting to the needs of individual surfaces. To better align recommendations with surface specific business goals, PinRec incorporates a novel outcome conditioned generation mechanism that targets different outcomes for each surface, which further enhances the impact of finetuning. Our experiments show that PinRec balances performance, diversity, and efficiency, delivering significant gains such as +4% increase in search saves. To our knowledge, this paper presents the first rigorous study of a unified generative retrieval model built and deployed at Pinterest scale, marking a significant milestone in the field.","Edoardo Botta, Jaewon Yang, Yi-Ping Hsu, Laksh Bhasin, Prabhat Agarwal, Anirudhan Badrinath, Yilin Chen, Jiajing Xu, Charles Rosenberg"
AgentDR: Dynamic Recommendation with Implicit Item-Item Relations via LLM-based Agents,https://arxiv.org/abs/2510.05598,"Recent agent-based recommendation frameworks aim to simulate user behaviors by incorporating memory mechanisms and prompting strategies, but they struggle with hallucinating non-existent items and full-catalog ranking. Besides, a largely underexplored opportunity lies in leveraging LLMs'commonsense reasoning to capture user intent through substitute and complement relationships between items, which are usually implicit in datasets and difficult for traditional ID-based recommenders to capture. In this work, we propose a novel LLM-agent framework, AgenDR, which bridges LLM reasoning with scalable recommendation tools. Our approach delegates full-ranking tasks to traditional models while utilizing LLMs to (i) integrate multiple recommendation outputs based on personalized tool suitability and (ii) reason over substitute and complement relationships grounded in user history. This design mitigates hallucination, scales to large catalogs, and enhances recommendation relevance through relational reasoning. Through extensive experiments on three public grocery datasets, we show that our framework achieves superior full-ranking performance, yielding on average a twofold improvement over its underlying tools. We also introduce a new LLM-based evaluation metric that jointly measures semantic alignment and ranking correctness.","Mingdai Yang, Nurendra Choudhary, Jiangshu Du, Edward W. Huang, Philip S. Yu, Karthik Subbian, Danai Kourta"
Generative Reasoning Re-ranker,https://arxiv.org/abs/2602.07774,"Recent studies increasingly explore Large Language Models (LLMs) as a new paradigm for recommendation systems due to their scalability and world knowledge. However, existing work has three key limitations: (1) most efforts focus on retrieval and ranking, while the reranking phase, critical for refining final recommendations, is largely overlooked; (2) LLMs are typically used in zero-shot or supervised fine-tuning settings, leaving their reasoning abilities, especially those enhanced through reinforcement learning (RL) and high-quality reasoning data, underexploited; (3) items are commonly represented by non-semantic IDs, creating major scalability challenges in industrial systems with billions of identifiers. To address these gaps, we propose the Generative Reasoning Reranker (GR2), an end-to-end framework with a three-stage training pipeline tailored for reranking. First, a pretrained LLM is mid-trained on semantic IDs encoded from non-semantic IDs via a tokenizer achieving $\ge$99% uniqueness. Next, a stronger larger-scale LLM generates high-quality reasoning traces through carefully designed prompting and rejection sampling, which are used for supervised fine-tuning to impart foundational reasoning skills. Finally, we apply Decoupled Clip and Dynamic sAmpling Policy Optimization (DAPO), enabling scalable RL supervision with verifiable rewards designed specifically for reranking. Experiments on two real-world datasets demonstrate GR2's effectiveness: it surpasses the state-of-the-art OneRec-Think by 2.4% in Recall@5 and 1.3% in NDCG@5. Ablations confirm that advanced reasoning traces yield substantial gains across metrics. We further find that RL reward design is crucial in reranking: LLMs tend to exploit reward hacking by preserving item order, motivating conditional verifiable rewards to mitigate this behavior and optimize reranking performance.","Mingfu Liang, Yufei Li, Jay Xu, Kavosh Asadi, Xi Liu, Shuo Gu, Kaushik Rangadurai, Frank Shyu, Shuaiwen Wang, Song Yang, Zhijing Li, Jiang Liu, Mengying Sun, Fei Tian, Xiaohan Wei, Chonglin Sun, Jacob Tao, Shike Mei, Wenlin Chen, Santanu Kolay, Sandeep Pandey, Hamed Firooz, Luke Simon"
When LLM Judges Inflate Scores: Exploring Overrating in Relevance Assessment,https://arxiv.org/abs/2602.17170,"Human relevance assessment is time-consuming and cognitively intensive, limiting the scalability of Information Retrieval evaluation. This has led to growing interest in using large language models (LLMs) as proxies for human judges. However, it remains an open question whether LLM-based relevance judgments are reliable, stable, and rigorous enough to match humans for relevance assessment. In this work, we conduct a systematic study of overrating behavior in LLM-based relevance judgments across model backbones, evaluation paradigms (pointwise and pairwise), and passage modification strategies. We show that models consistently assign inflated relevance scores -- often with high confidence -- to passages that do not genuinely satisfy the underlying information need, revealing a system-wide bias rather than random fluctuations in judgment. Furthermore, controlled experiments show that LLM-based relevance judgments can be highly sensitive to passage length and surface-level lexical cues. These results raise concerns about the usage of LLMs as drop-in replacements for human relevance assessors, and highlight the urgent need for careful diagnostic evaluation frameworks when applying LLMs for relevance assessments. Our code and results are publicly available.","Chuting Yu, Hang Li, Guido Zuccon, Joel Mackenzie, Teerapong Leelanupab"
Sequential Data Augmentation for Generative Recommendation,https://arxiv.org/abs/2509.13648,"Generative recommendation plays a crucial role in personalized systems, predicting users' future interactions from their historical behavior sequences. A critical yet underexplored factor in training these models is data augmentation, the process of constructing training data from user interaction histories. By shaping the training distribution, data augmentation directly and often substantially affects model generalization and performance. Nevertheless, in much of the existing work, this process is simplified, applied inconsistently, or treated as a minor design choice, without a systematic and principled understanding of its effects.
  Motivated by our empirical finding that different augmentation strategies can yield large performance disparities, we conduct an in-depth analysis of how they reshape training distributions and influence alignment with future targets and generalization to unseen inputs. To systematize this design space, we propose GenPAS, a generalized and principled framework that models augmentation as a stochastic sampling process over input-target pairs with three bias-controlled steps: sequence sampling, target sampling, and input sampling. This formulation unifies widely used strategies as special cases and enables flexible control of the resulting training distribution. Our extensive experiments on benchmark and industrial datasets demonstrate that GenPAS yields superior accuracy, data efficiency, and parameter efficiency compared to existing strategies, providing practical guidance for principled training data construction in generative recommendation. Our code is available at https://github.com/snap-research/GenPAS.","Geon Lee, Bhuvesh Kumar, Clark Mingxuan Ju, Tong Zhao, Kijung Shin, Neil Shah, Liam Collins"
Beyond a Million Tokens: Benchmarking and Enhancing Long-Term Memory in LLMs,https://arxiv.org/abs/2510.27246,"Evaluating the abilities of large language models (LLMs) for tasks that require long-term memory and thus long-context reasoning, for example in conversational settings, is hampered by the existing benchmarks, which often lack narrative coherence, cover narrow domains, and only test simple recall-oriented tasks. This paper introduces a comprehensive solution to these challenges. First, we present a novel framework for automatically generating long (up to 10M tokens), coherent, and topically diverse conversations, accompanied by probing questions targeting a wide range of memory abilities. From this, we construct BEAM, a new benchmark comprising 100 conversations and 2,000 validated questions. Second, to enhance model performance, we propose LIGHT-a framework inspired by human cognition that equips LLMs with three complementary memory systems: a long-term episodic memory, a short-term working memory, and a scratchpad for accumulating salient facts. Our experiments on BEAM reveal that even LLMs with 1M token context windows (with and without retrieval-augmentation) struggle as dialogues lengthen. In contrast, LIGHT consistently improves performance across various models, achieving an average improvement of 3.5%-12.69% over the strongest baselines, depending on the backbone LLM. An ablation study further confirms the contribution of each memory component.","Mohammad Tavakoli, Alireza Salemi, Carrie Ye, Mohamed Abdalla, Hamed Zamani, J Ross Mitchell"
