Title,Link,Desc,author
Inference-Free Multimodal Learned Sparse Retrieval for Production-Scale Visual Document Search,https://arxiv.org/abs/2605.30917,"As large-scale visual-document corpora such as arXiv papers and enterprise PDFs continue to grow, visual-document retrieval has gained increasing attention; yet it still lacks a deployable system that lexically indexes visual documents to serve queries without neural encoding at scale. Existing methods either achieve strong retrieval quality with VLM-based dense or multi-vector models but require neural query encoding at serving time, or avoid query encoding with OCR- or caption-based BM25 at the cost of time-consuming text extraction or generation. To fill this missing serving regime, we present V-SPLADE, an inference-free sparse retriever for visual-document retrieval. However, such inference-free multimodal learned sparse retrieval systems remain underexplored and have not yet shown dense-level effectiveness under high sparsity. We attribute this limitation to a lexical grounding problem: visual sparse representations often fail to capture the lexical content embedded in document images. To address this problem, we introduce caption-gated token supervision, a training-only signal that uses VLM-generated captions as lexical cues to activate retrieval-relevant vocabulary dimensions. With this supervision, V-SPLADE improves average NDCG@5 across six visual-document retrieval benchmarks by +13.8pp over the same-scale dense baseline and by up to +6.3pp over OCR- or caption-based BM25 baselines. On an 18.7M-document corpus, it more than doubles R@5 over the same-scale dense baseline and further improves competing retrievers through score fusion by up to +2.4pp R@5. Code will be released soon at https://github.com/naver/v-splade.","Gyu-Hwung Cho (NAVER Corp., Republic of Korea, Seoul National University, Republic of Korea), Youngjune Lee (NAVER Corp., Republic of Korea), Kiyoon Jeong (NAVER Corp., Republic of Korea), Siyoung Lee (NAVER Corp., Republic of Korea), Sanggyu Han (NAVER Corp., Republic of Korea), Herv\'e Dejean (Naver Labs Europe, France), St\'ephane Clinchant (Naver Labs Europe, France), Seung-won Hwang (Seoul National University, Republic of Korea)"
Graph-GRPO: Dependency-Aware Credit Assignment for Generative E-commerce Search Relevance,https://arxiv.org/abs/2605.31003,"Search relevance modeling is a core task in e-commerce search systems, assessing how well a user query matches candidate products. Rather than relying on a single holistic matching signal, relevance judgment often requires structured reasoning over query understanding, product understanding, and facet-level matching. With large language models (LLMs), this process is increasingly formulated as chain-of-thought (CoT) reasoning and optimized with reinforcement learning (RL). However, existing RL methods mainly rely on outcome-level rewards and treat the entire reasoning chain as a single optimization unit. This makes it difficult to distinguish faulty reasoning steps from correct intermediate ones, leading to misaligned credit assignment. Although process-reward methods provide denser supervision, they often treat reasoning steps independently and ignore dependency-driven error propagation, making responsibility attribution difficult and limiting the optimization of structured relevance reasoning. We propose Graph-GRPO, a graph-structured extension of GRPO for multi-component relevance reasoning. Graph-GRPO constructs a relevance reasoning dependency graph, where CoT steps are modeled as nodes and their logical dependencies as edges. It propagates outcome-level rewards over the graph to derive step-level credit signals, enabling more accurate fine-grained credit assignment. We further introduce a main-loss-driven controller that adaptively adjusts edge-wise credit-propagation coefficients. Together with CoT random masking for supervised policy initialization and graph-node-based multi-head distillation, we build a trainable and deployable framework for generative relevance modeling. Extensive offline evaluations and online A/B tests on a leading e-commerce platform demonstrate that the Graph-GRPO-based framework improves relevance classification metrics and key engagement metrics.","Jiarui Che, Yifei Chen, Zhixing Tian, Chenyang Wang, Ziguang Cheng"
An Organization-Scoped LLM Agent Runtime Architecture for Regulated Cybersecurity Operations,https://arxiv.org/abs/2605.30604,"Regulated cybersecurity workflows lack a runtime substrate that enforces organization-level scope across retrieval, tool calls, memory, findings, reports, and audit while remaining model-agnostic and locally deployable. Recent large language model (LLM) agent systems report strong results on isolated cybersecurity tasks, yet they do not by themselves define an auditable platform architecture for regulated security operations centre (SOC) and compliance workflows, where a single analyst may trigger actions that bind the organization, and where the runtime must integrate with existing SIEM/XDR stacks as a primary source of context and alert-driven triggers rather than operate as a standalone analytical layer. This paper proposes an organization-scoped LLM agent runtime architecture for financial cybersecurity. The contribution is a typed Security Context that is created at every entry point, including SIEM/XDR notifications ingested as first-class triggers, and enforced at every component boundary, combined with a shared Runtime Core, logical specialist subagents, a governed Tool Adapter Layer exposing SIEM/XDR query, enrichment, and response primitives under uniform policy and audit, structured findings with evidence references, tiered human-in-the-loop (HITL) gates, and append-only audit. Model Context Protocol (MCP), extended telemetry, digital twins for pentesting, graph retrieval, and federated knowledge sharing are treated as optional extension paths rather than mandatory runtime assumptions. We describe an implementable slice as the architecture's testability surface, and we propose a falsifiable evaluation plan with metric-level pass criteria for architecture readiness, security-policy enforcement, evidence traceability, output quality, and operational observability.","George Fatouros, Georgios Makridis, George Kousiouris, John Soldatos, Dimosthenis Kyriazis"
GEM-Bench: A Benchmark for Ad-Injected Response Generation within Generative Engine Marketing,https://arxiv.org/abs/2509.14221,"Generative Engine Marketing (GEM) is an emerging ecosystem for monetizing generative engines, such as LLM-based chatbots, by seamlessly integrating relevant advertisements into their responses. At the core of GEM lies the generation and evaluation of ad-injected responses. However, existing benchmarks are not specifically designed for this purpose, which limits future research. To address this gap, we propose GEM-Bench, the first comprehensive benchmark for ad-injected response generation in GEM. GEM-Bench includes three curated datasets covering both chatbot and search scenarios, a metric ontology that captures multiple dimensions of user satisfaction and engagement, and several baseline solutions implemented within an extensible multi-agent framework. Our preliminary results indicate that, while simple prompt-based methods achieve reasonable engagement such as click-through rate, they often reduce user satisfaction. In contrast, approaches that insert ads based on pre-generated ad-free responses help mitigate this issue but introduce additional overhead. These findings highlight the need for future research on designing more effective and efficient solutions for generating ad-injected responses in GEM. The benchmark and all related resources are publicly available at https://gem-bench.org/.","Silan Hu, Shiqi Zhang, Yimin Shi, Xiaokui Xiao"
Climber-Pilot: A Non-Myopic Generative Recommendation Model Towards Better Instruction-Following,https://arxiv.org/abs/2602.13581,"Generative retrieval has emerged as a promising paradigm in recommender systems, offering superior sequence modeling capabilities over traditional dual-tower architectures. However, in large-scale industrial scenarios, such models often suffer from inherent myopia: due to single-step inference and strict latency constraints, they tend to collapse diverse user intents into locally optimal predictions, failing to capture long-horizon and multi-item consumption patterns. Moreover, real-world retrieval systems must follow explicit retrieval instructions, such as category-level control and policy constraints. Incorporating such instruction-following behavior into generative retrieval remains challenging, as existing conditioning or post-hoc filtering approaches often compromise relevance or efficiency. In this work, we present Climber-Pilot, a unified generative retrieval framework to address both limitations. First, we introduce Time-Aware Multi-Item Prediction (TAMIP), a novel training paradigm designed to mitigate inherent myopia in generative retrieval. By distilling long-horizon, multi-item foresight into model parameters through time-aware masking, TAMIP alleviates locally optimal predictions while preserving efficient single-step inference. Second, to support flexible instruction-following retrieval, we propose Condition-Guided Sparse Attention (CGSA), which incorporates business constraints directly into the generative process via sparse attention, without introducing additional inference steps. Extensive offline experiments and online A/B testing at NetEase Cloud Music, one of the largest music streaming platforms, demonstrate that Climber-Pilot significantly outperforms state-of-the-art baselines, achieving a 4.24\% lift of the core business metric.","Da Guo, Shijia Wang, Qiang Xiao, Yintao Ren, Weisheng Li, Songpei Xu, Ming Yue, Bin Huang, Guanlin Wu, Chuanjiang Luo"
APAO: Adaptive Prefix-Aware Optimization for Generative Recommendation,https://arxiv.org/abs/2603.02730,"Generative recommendation has recently emerged as a promising paradigm for sequential recommendation. It formulates the task as an autoregressive generation process, predicting tokens of the next item conditioned on user interaction histories. Existing generative recommendation models are typically trained with token-level likelihood objectives such as cross-entropy loss, while employing beam search during inference to generate ranked candidates. However, this leads to a fundamental training-inference inconsistency: standard training assumes ground-truth tokens are always available, while beam search prunes low-probability branches during inference, causing the correct item to be prematurely discarded when its prefixes receive low scores. To address this issue, we propose the Adaptive Prefix-Aware Optimization (APAO) framework, which introduces prefix-level optimization losses to better align the training objective with the inference setting. Furthermore, we design an adaptive worst-prefix optimization strategy that dynamically focuses on the most vulnerable prefixes during training, thereby enhancing the model's ability to retain correct candidates under beam search constraints. We provide theoretical analyses to demonstrate the effectiveness and efficiency of our framework. Extensive experiments show that APAO consistently alleviates the training-inference inconsistency and improves performance across generative recommendation backbones. The source code is publicly available at https://github.com/yuyq18/APAO.","Yuanqing Yu, Yifan Wang, Weizhi Ma, Zhiqiang Guo, Min Zhang"
Aligning Dense Retrievers with LLM Utility via Distillation,https://arxiv.org/abs/2604.22722,"Dense vector retrieval is the practical backbone of Retrieval- Augmented Generation (RAG), but similarity search can suffer from precision limitations. Conversely, utility-based approaches leveraging LLM re-ranking often achieve superior performance but are computationally prohibitive and prone to noise inherent in perplexity estimation. We propose Utility-Aligned Embeddings (UAE), a framework designed to merge these advantages into a practical, high-performance retrieval method. We formulate retrieval as a distribution matching problem, training a bi-encoder to imitate a utility distribution derived from perplexity reduction using a Utility-Modulated InfoNCE objective. This approach injects graded utility signals directly into the embedding space without requiring test-time LLM inference. On the QASPER benchmark, UAE improves retrieval Recall@1 by 30.59%, MAP by 30.16% and Token F1 by 17.3% over the strong semantic baseline BGE-Base. Crucially, UAE is over 180x faster than the efficient LLM re-ranking methods preserving competitive performance, demonstrating that aligning retrieval with generative utility yields reliable contexts at scale.","Rajinder Sandhu, Di Mu, Cheng Chang, Md Shahriar Tasjid, Himanshu Rai, Maksims Volkovs, Ga Wu"
Mixture-of-Experts Knowledge Graph Retrieval-Augmented Generation for Multi-Agent LLM-based Recommendation,https://arxiv.org/abs/2605.28175,"Large language models (LLMs) have recently been adopted for recommendations due to their ability to understand user intent and item semantics. However, LLM-based recommender systems often rely on parametric knowledge and suffer from outdated knowledge, motivating knowledge graph retrieval-augmented generation (KG-RAG) to ground recommendations on structured, up-to-date KGs. Despite this promise, effective KG-RAG in recommendations faces great challenges. First, users' queries vary in complexity and require KG knowledge at different granularities, whereas existing methods adopt a one-size-fits-all retrieval strategy, leading to over-retrieval for simple queries and under-retrieval for complex ones. In addition, augmenting LLMs with KG knowledge requires translating graph-structured data into linear text, which may introduce noise and cause structural information loss. Moreover, the selection of retrieval granularity lacks direct supervision and must be inferred from the final recommendation after alignment and downstream utilization, making query-aware retrieval hard to learn end-to-end. To address these issues, we propose MixRAGRec, a cooperative multi-agent framework for KG-RAG recommendations. MixRAGRec integrates a Mixture-of-Experts Retrieval Agent that routes each query to a KG retrieval expert with different granularities, a Knowledge Preference Alignment Agent that converts structured knowledge into LLM-friendly natural language, and a Contrastive Learning-reinforced Recommendation Agent trained with contrastive preference feedback. Notably, we introduce Mixture-of-Experts Multi-Agent Policy Optimization (MMAPO) to train three agents under a unified objective. Extensive experiments on real-world datasets demonstrate the effectiveness of our framework.","Shijie Wang, Chengyi Liu, Yujuan Ding, Shanru Lin, See-Kiong Ng, Xu Xin, Wenqi Fan"
DeepImageSearch: Benchmarking Multimodal Agents for Context-Aware Image Retrieval in Visual Histories,https://arxiv.org/abs/2602.10809,"Existing multimodal retrieval systems excel at semantic matching but implicitly assume that query-image relevance can be measured in isolation. This paradigm overlooks the rich dependencies inherent in realistic visual streams, where information is distributed across temporal sequences rather than confined to single snapshots. To bridge this gap, we introduce DeepImageSearch, a novel agentic paradigm that reformulates image retrieval as an autonomous exploration task. Models must plan and perform multi-step reasoning over raw visual histories to locate targets based on implicit contextual cues. We construct DISBench, a challenging benchmark built on interconnected visual data. To address the scalability challenge of creating context-dependent queries, we propose a human-model collaborative pipeline that employs vision-language models to mine latent spatiotemporal associations, effectively offloading intensive context discovery before human verification. Furthermore, we build a robust baseline using a modular agent framework equipped with fine-grained tools and a dual-memory system for long-horizon navigation. Extensive experiments demonstrate that DISBench poses significant challenges to state-of-the-art models, highlighting the necessity of incorporating agentic reasoning into next-generation retrieval systems.","Chenlong Deng, Mengjie Deng, Junjie Wu, Dun Zeng, Teng Wang, Qingsong Xie, Jiadeng Huang, Shengjie Ma, Changwang Zhang, Zhaoxiang Wang, Jun Wang, Yutao Zhu, Zhicheng Dou"
